{
  "$schema": "https://json-schema.org/draft/2020-12/schema",
  "$id": "TemplateSchema/v2",
  "title": "Template Schema v1",
  "description": "Document集約の一documentType（Template）。advisor Skillの回答テンプレート（ddd-advisor/tech-lead-advisor/qa-advisor等が`references/template-*.md`として持つ、`{{プレースホルダー}}`混じりの回答骨格）を構造化する。templateKindで骨格の種類を判別する（現状は既に複数のadvisorで繰り返し観測された『判断相談』骨格のみ。概念質問・実装相談等の骨格はまだ実例が1つずつしかなく、architecture-evidence-based-scope（YAGNI）の基準に照らして時期尚早のため対象外——将来、同じ骨格が複数回観測された時点で新しいtemplateKindとして追加する）。この文書自体の値（trigger.text等）は最終的な回答内容ではなく、advisorが相談ごとに埋める『{{}}』プレースホルダーを含んだテンプレート文字列そのものである点に注意。",
  "type": "object",
  "required": [
    "documentId",
    "documentType",
    "schemaRef",
    "templateKind",
    "skillRef",
    "status",
    "content"
  ],
  "x-source-target": ".waffle/documents/templates/{documentId}.json",
  "x-render-target": {
    "formats": [
      "md"
    ],
    "pathVars": {
      "judgment": {
        "skillRef": "doc.skillRef"
      },
      "investigation-report": {
        "skillRef": "doc.skillRef"
      }
    },
    "path": {
      "judgment": ".waffle/templates/{documentId}.md",
      "investigation-report": ".waffle/templates/{documentId}.md"
    },
    "deploy": {
      "judgment": [
        ".claude/skills/{skillRef}/references/{documentId}.md"
      ],
      "investigation-report": [
        ".claude/skills/{skillRef}/references/{documentId}.md"
      ]
    }
  },
  "allOf": [
    {
      "if": {
        "properties": {
          "templateKind": {
            "const": "judgment"
          }
        },
        "required": [
          "templateKind"
        ]
      },
      "then": {
        "properties": {
          "content": {
            "$ref": "#/$defs/JudgmentTemplateContent"
          }
        }
      }
    },
    {
      "if": {
        "properties": {
          "templateKind": {
            "const": "investigation-report"
          }
        },
        "required": [
          "templateKind"
        ]
      },
      "then": {
        "properties": {
          "content": {
            "$ref": "#/$defs/InvestigationReportTemplateContent"
          }
        }
      }
    }
  ],
  "properties": {
    "documentId": {
      "type": "string",
      "x-prompt-write": "このTemplateを一意に識別するIDを kebab-case で付けてください。deploy先のファイル名にもそのまま使われます。例: template-judgment, template-strength-assessment"
    },
    "documentType": {
      "type": "string",
      "const": "Template"
    },
    "schemaRef": {
      "type": "string",
      "const": "TemplateSchema/v2"
    },
    "templateKind": {
      "type": "string",
      "enum": [
        "judgment",
        "investigation-report"
      ],
      "x-prompt-write": "骨格の種類を指定してください。現状は判断相談（診断フロー→判定→推奨アクション→注意という骨格）を意味する judgment のみ対応。"
    },
    "skillRef": {
      "type": "string",
      "x-prompt-write": "このTemplateが属するSkillを、そのSkillのID（kebab-case、そのSkill自身に付けられた識別子）で指定してください。例: tech-lead-advisor, qa-advisor。このIDが、指定したSkillの配下へこのTemplateの成果物を配置する際の手がかりになります。"
    },
    "status": {
      "type": "string",
      "enum": [
        "DRAFT",
        "ACTIVE",
        "DEPRECATED"
      ],
      "x-prompt-write": "作成中は DRAFT、利用可能になったら ACTIVE、廃止する場合は DEPRECATED を指定してください。"
    },
    "tags": {
      "type": "array",
      "items": {
        "type": "string"
      },
      "x-prompt-write": "このTemplateを分類するタグを付けてください。例: [\"skill:qa-advisor\"]"
    },
    "createdAt": {
      "type": "string",
      "format": "date-time"
    },
    "updatedAt": {
      "type": "string",
      "format": "date-time"
    },
    "_index": {
      "description": "waffle が x-prompt-query から自動生成する。AI は直接書かない。",
      "readOnly": true,
      "type": "object",
      "properties": {
        "blocks": {
          "type": "object",
          "additionalProperties": {
            "type": "object",
            "required": [
              "blockType",
              "prompt"
            ],
            "properties": {
              "blockType": {
                "type": "string"
              },
              "prompt": {
                "type": "string"
              }
            }
          }
        }
      }
    },
    "content": {}
  },
  "$defs": {
    "JudgmentTemplateContent": {
      "type": "object",
      "required": [
        "title",
        "trigger",
        "diagnosticFlow",
        "verdict",
        "recommendedAction",
        "antiPatternNote",
        "description"
      ],
      "additionalProperties": false,
      "properties": {
        "title": {
          "$ref": "#/$defs/TitleBlock"
        },
        "trigger": {
          "$ref": "#/$defs/TriggerBlock"
        },
        "contextBlocks": {
          "$ref": "#/$defs/ContextBlocksBlock"
        },
        "diagnosticFlow": {
          "$ref": "#/$defs/DiagnosticFlowBlock"
        },
        "verdict": {
          "$ref": "#/$defs/VerdictBlock"
        },
        "recommendedAction": {
          "$ref": "#/$defs/RecommendedActionBlock"
        },
        "extraSections": {
          "$ref": "#/$defs/ExtraSectionsBlock"
        },
        "antiPatternNote": {
          "$ref": "#/$defs/AntiPatternNoteBlock"
        },
        "description": {
          "$ref": "#/$defs/DescriptionBlock"
        }
      }
    },
    "TitleBlock": {
      "type": "object",
      "required": [
        "blockType",
        "title"
      ],
      "x-render-order": 0,
      "x-render-level": 1,
      "x-prompt-query": "まず何を扱う文書かを掴むために読みます。説明部分が識別子の言い換えになっていたら、何を扱うかがまだ決まっていない合図です。",
      "x-render": [],
      "properties": {
        "blockType": {
          "type": "string",
          "const": "Title"
        },
        "title": {
          "type": "string",
          "x-prompt-write": "「業務語彙の説明：識別子」の形式で設定してください。説明部分はこのTemplateが何のためのものかを業務語彙で簡潔に表す句（このTemplateのIDをそのまま繰り返さない）。末尾にtemplateKindを表す語（judgmentなら「〜の回答テンプレート」、investigation-reportなら「〜の調査報告テンプレート」）を含め、読んだだけでこのTemplateがどの種別かがわかるようにしてください。識別子部分はこのTemplateのIDをそのまま使う。"
        }
      }
    },
    "TriggerBlock": {
      "type": "object",
      "required": [
        "blockType",
        "title",
        "text",
        "openingLine"
      ],
      "x-render-order": 1,
      "x-render-level": 2,
      "x-prompt-query": "この型を使う場面かどうかを見極めるために読みます。属する技能の本文にある発動条件の一覧とは別で、こちらは1つの型に絞った条件です。",
      "x-render": [
        {
          "as": "paragraph",
          "from": "text"
        },
        {
          "as": "paragraph",
          "from": "openingLine"
        }
      ],
      "properties": {
        "blockType": {
          "type": "string",
          "const": "Trigger"
        },
        "title": {
          "type": "string",
          "const": "使用条件"
        },
        "text": {
          "type": "string",
          "x-prompt-write": "この骨格がいつ使われるべきかを一文で書いてください（例:「『このコードはどこに置くべきか』等の配置・依存方向に関する判断を求める相談」）。実際の相談文ではなく、発動条件の説明であることに注意。"
        },
        "openingLine": {
          "type": "string",
          "x-prompt-write": "判断フローに入る前に相談対象を一文でスコープする文を{{}}プレースホルダー込みで書いてください（例:「{{対象（ユーザーが提示したシステム・機能・設計）}}について判断します。」）。"
        }
      }
    },
    "ContextBlocksBlock": {
      "type": "object",
      "required": [
        "blockType",
        "title",
        "items",
        "emptyReason"
      ],
      "x-render-order": 2,
      "x-render-level": 2,
      "x-prompt-query": "判断へ入る前に、前提となる分類を確かめるために読みます。ここを飛ばすと、後段の判断が違う土俵の上で行われます。空なら前置きは不要という意味です。",
      "x-render": [
        {
          "as": "section",
          "from": "items",
          "titleFrom": "title",
          "each": [
            {
              "as": "paragraph",
              "from": "guidance"
            }
          ]
        }
      ],
      "properties": {
        "blockType": {
          "type": "string",
          "const": "ContextBlocks"
        },
        "title": {
          "type": "string",
          "const": "前置きセクション"
        },
        "items": {
          "type": "array",
          "x-prompt-write": "判断フローに入る前に確認させたい前提（分類・階層等）があれば、見出しと、そこに何を書くべきかの指示（{{}}プレースホルダー込み）を列挙してください。不要なら空配列。",
          "items": {
            "type": "object",
            "required": [
              "title",
              "guidance"
            ],
            "properties": {
              "title": {
                "type": "string",
                "x-prompt-write": "前置きセクションの見出し。例: サブドメイン分類"
              },
              "guidance": {
                "type": "string",
                "x-prompt-write": "そのセクションに何を書くべきかの指示文（{{}}プレースホルダーを使う）。"
              }
            }
          }
        },
        "emptyReason": {
          "type": "string",
          "x-prompt-write": "itemsが空配列の場合、前置きセクションが不要な理由を書いてください。空でない場合は空文字でよい。"
        }
      }
    },
    "DiagnosticFlowBlock": {
      "type": "object",
      "required": [
        "blockType",
        "title",
        "items"
      ],
      "x-render-order": 3,
      "x-render-level": 2,
      "x-prompt-query": "判断・診断の起点となる問いと、その分岐（YES/NO等）を持ちます。骨格の核であり、advisorが相談ごとにこの構造を辿って回答を組み立てる。",
      "x-render": [
        {
          "as": "section",
          "from": "items",
          "titleFrom": "question",
          "each": [
            {
              "as": "table",
              "from": "branches",
              "columns": [
                {
                  "field": "condition",
                  "header": "条件"
                },
                {
                  "field": "then",
                  "header": "結果"
                }
              ]
            }
          ]
        }
      ],
      "properties": {
        "blockType": {
          "type": "string",
          "const": "DiagnosticFlow"
        },
        "title": {
          "type": "string",
          "x-prompt-write": "このセクションの見出しを書いてください。骨格の性質に応じて『判断フロー』『診断フロー』『計画フロー』等、文脈に合った語を選んでよい（見出し語自体は骨格ごとに変わってよいが、直後のitemsの構造は共通）。"
        },
        "items": {
          "type": "array",
          "x-prompt-write": "問いを順に列挙してください。各問いは{{}}プレースホルダーを含む問い文と、条件ごとの分岐（次の問いへ進む／最終的な結論に至る）を持たせてください。",
          "items": {
            "type": "object",
            "required": [
              "questionId",
              "question",
              "branches"
            ],
            "properties": {
              "questionId": {
                "type": "string",
                "x-prompt-write": "問いの識別子。例: q1"
              },
              "question": {
                "type": "string",
                "x-prompt-write": "問い文（{{}}プレースホルダーを含む）。例:「{{判断の起点となる問い}}」"
              },
              "branches": {
                "type": "array",
                "x-prompt-write": "この問いに対する条件ごとの分岐を列挙してください。",
                "items": {
                  "type": "object",
                  "required": [
                    "condition",
                    "then"
                  ],
                  "properties": {
                    "condition": {
                      "type": "string",
                      "x-prompt-write": "分岐条件（例: YESの条件、NOの条件）。"
                    },
                    "then": {
                      "type": "string",
                      "x-prompt-write": "その条件のときどうなるか（次の問いへ進む旨、または結論そのもの）。"
                    }
                  }
                }
              }
            }
          }
        }
      }
    },
    "VerdictBlock": {
      "type": "object",
      "required": [
        "blockType",
        "title",
        "guidance"
      ],
      "x-render-order": 4,
      "x-render-level": 2,
      "x-prompt-query": "結論をどう書くかを読みます。次に何をすべきかはここではなく推奨の側が持つため、混ぜないでください。",
      "x-render": [
        {
          "as": "paragraph",
          "from": "guidance"
        }
      ],
      "properties": {
        "blockType": {
          "type": "string",
          "const": "Verdict"
        },
        "title": {
          "type": "string",
          "const": "判定"
        },
        "guidance": {
          "type": "string",
          "x-prompt-write": "判定結果をどう提示すべきかの指示を{{}}プレースホルダー込みで書いてください。判定理由（バックボーンの定義・原則に基づく根拠）を必ず示すよう指示に含めること。"
        }
      }
    },
    "RecommendedActionBlock": {
      "type": "object",
      "required": [
        "blockType",
        "title",
        "guidance"
      ],
      "x-render-order": 5,
      "x-render-level": 2,
      "x-prompt-query": "次の一手をどう書くかを読みます。判定と同じ節に混ぜると、何が事実で何が提案かが読み手に区別できなくなります。",
      "x-render": [
        {
          "as": "paragraph",
          "from": "guidance"
        }
      ],
      "properties": {
        "blockType": {
          "type": "string",
          "const": "RecommendedAction"
        },
        "title": {
          "type": "string",
          "const": "推奨アクション"
        },
        "guidance": {
          "type": "string",
          "x-prompt-write": "推奨アクションをどう提示すべきかの指示を{{}}プレースホルダー込みで書いてください。動詞で始まる具体的な行動を示すよう指示に含めること。"
        }
      }
    },
    "ExtraSectionsBlock": {
      "type": "object",
      "required": [
        "blockType",
        "title",
        "items",
        "emptyReason"
      ],
      "x-render-order": 6,
      "x-render-level": 2,
      "x-prompt-query": "この型に固有の追加節があるかを読みます。空なら、判定と推奨だけで完結するという意味です。",
      "x-render": [
        {
          "as": "section",
          "from": "items",
          "titleFrom": "title",
          "each": [
            {
              "as": "paragraph",
              "from": "guidance"
            }
          ]
        }
      ],
      "properties": {
        "blockType": {
          "type": "string",
          "const": "ExtraSections"
        },
        "title": {
          "type": "string",
          "const": "追加セクション"
        },
        "items": {
          "type": "array",
          "x-prompt-write": "判定・推奨アクションの後に必要な追加セクションがあれば、見出しと書き方の指示を列挙してください。不要なら空配列。",
          "items": {
            "type": "object",
            "required": [
              "title",
              "guidance"
            ],
            "properties": {
              "title": {
                "type": "string",
                "x-prompt-write": "追加セクションの見出し。例: 診断的差し戻し（該当する場合のみ）"
              },
              "guidance": {
                "type": "string",
                "x-prompt-write": "そのセクションに何を書くべきかの指示文（{{}}プレースホルダーを使う）。"
              }
            }
          }
        },
        "emptyReason": {
          "type": "string",
          "x-prompt-write": "itemsが空配列の場合、追加セクションが不要な理由を書いてください。空でない場合は空文字でよい。"
        }
      }
    },
    "AntiPatternNoteBlock": {
      "type": "object",
      "required": [
        "blockType",
        "title",
        "guidance"
      ],
      "x-render-order": 7,
      "x-render-level": 2,
      "x-prompt-query": "判定がアンチパターンに該当する場合にのみ書くべき注意の書き方を持ちます。",
      "x-render": [
        {
          "as": "paragraph",
          "from": "guidance"
        }
      ],
      "properties": {
        "blockType": {
          "type": "string",
          "const": "AntiPatternNote"
        },
        "title": {
          "type": "string",
          "const": "注意（アンチパターンに該当する場合のみ）"
        },
        "guidance": {
          "type": "string",
          "x-prompt-write": "アンチパターンに該当する場合に何を書くべきかの指示を{{}}プレースホルダー込みで書いてください。該当するアンチパターン名とリスクをセットで示すよう指示に含めること。"
        }
      }
    },
    "FindingsGuidanceBlock": {
      "type": "object",
      "required": [
        "blockType",
        "title",
        "guidance"
      ],
      "x-render-order": 1,
      "x-render-level": 2,
      "x-prompt-query": "分かったことをどう書くかを読みます。分からなかったことと混ぜないための指針がここにあります。",
      "x-render": [
        {
          "as": "paragraph",
          "from": "guidance"
        }
      ],
      "properties": {
        "blockType": {
          "type": "string",
          "const": "FindingsGuidance"
        },
        "title": {
          "type": "string",
          "const": "分かったこと"
        },
        "guidance": {
          "type": "string",
          "x-prompt-write": "対象範囲を読んで判明した事実の書き方を{{}}プレースホルダー込みで書いてください。各項目には根拠（ファイルパス・行番号・引用等）を必ず添えるよう指示に含めること。"
        }
      }
    },
    "UnknownsGuidanceBlock": {
      "type": "object",
      "required": [
        "blockType",
        "title",
        "guidance"
      ],
      "x-render-order": 2,
      "x-render-level": 2,
      "x-prompt-query": "分からなかったことをどう書くかを読みます。確かめられなかった事項を分かったかのように書かないための歯止めです。",
      "x-render": [
        {
          "as": "paragraph",
          "from": "guidance"
        }
      ],
      "properties": {
        "blockType": {
          "type": "string",
          "const": "UnknownsGuidance"
        },
        "title": {
          "type": "string",
          "const": "分からなかったこと"
        },
        "guidance": {
          "type": "string",
          "x-prompt-write": "確認できなかった事項・判断がつかなかった事項の書き方を{{}}プレースホルダー込みで書いてください。「分かったこと」と混同せず、不明であることを明示するよう指示に含めること。"
        }
      }
    },
    "EvidenceGuidanceBlock": {
      "type": "object",
      "required": [
        "blockType",
        "title",
        "guidance"
      ],
      "x-render-order": 3,
      "x-render-level": 2,
      "x-prompt-query": "根拠をどう示すかを読みます。読み手が同じ場所を開いて確かめられる形になっているかが基準です。",
      "x-render": [
        {
          "as": "paragraph",
          "from": "guidance"
        }
      ],
      "properties": {
        "blockType": {
          "type": "string",
          "const": "EvidenceGuidance"
        },
        "title": {
          "type": "string",
          "const": "根拠の書き方"
        },
        "guidance": {
          "type": "string",
          "x-prompt-write": "各項目の根拠の示し方を{{}}プレースホルダー込みで書いてください。ファイルパス・行番号・該当箇所の引用を使うよう指示に含めること。"
        }
      }
    },
    "InvestigationReportTemplateContent": {
      "type": "object",
      "required": [
        "title",
        "findingsGuidance",
        "unknownsGuidance",
        "evidenceGuidance",
        "description"
      ],
      "additionalProperties": false,
      "properties": {
        "title": {
          "$ref": "#/$defs/TitleBlock"
        },
        "findingsGuidance": {
          "$ref": "#/$defs/FindingsGuidanceBlock"
        },
        "unknownsGuidance": {
          "$ref": "#/$defs/UnknownsGuidanceBlock"
        },
        "evidenceGuidance": {
          "$ref": "#/$defs/EvidenceGuidanceBlock"
        },
        "description": {
          "$ref": "#/$defs/DescriptionBlock"
        }
      }
    },
    "DescriptionBlock": {
      "type": "object",
      "required": [
        "blockType",
        "title",
        "text"
      ],
      "x-render-order": -1,
      "x-render-level": 2,
      "x-prompt-query": "この型を開くかどうかを判断するために読みます。ここで用が足りるなら先へ進む必要はありません。",
      "x-render": [
        {
          "as": "paragraph",
          "from": "text"
        }
      ],
      "properties": {
        "blockType": {
          "type": "string",
          "const": "Description"
        },
        "title": {
          "type": "string",
          "const": "概要"
        },
        "text": {
          "type": "string",
          "x-prompt-write": "このテンプレートが何を扱うか（どんな判断相談・調査報告の骨格に対応するテンプレートか）を1〜2文で書いてください。本文を読まなくてもこのテンプレートの用途と対象範囲が伝わることを目的とするため、抽象的な言い換えではなく、対象となる判断・調査の種類が具体的にわかる言葉を選んでください。"
        }
      }
    }
  },
  "x-frontmatter": {
    "judgment": {
      "id": "doc.documentId",
      "type": "doc.templateKind",
      "title": "doc.content.title.title",
      "description": "doc.content.description",
      "tags": "doc.tags",
      "schemaRef": "doc.schemaRef",
      "updatedAt": "doc.updatedAt"
    },
    "investigation-report": {
      "id": "doc.documentId",
      "type": "doc.templateKind",
      "title": "doc.content.title.title",
      "description": "doc.content.description",
      "tags": "doc.tags",
      "schemaRef": "doc.schemaRef",
      "updatedAt": "doc.updatedAt"
    }
  }
}
